{
  "analysis_regime": "",
  "claim_boundary": "",
  "conclusion": "",
  "confidence": 0.0,
  "evidence_facts": [],
  "held_fixed": [],
  "mechanism": "",
  "mechanism_tags": [],
  "numeric_results": {},
  "recommended_actions": [],
  "schema_version": "1.0",
  "task_id": "diagnosis_stale_evidence--counterexample"
}
