{
  "analysis_regime": "ac",
  "claim_boundary": "Limited to the supplied operating regime and held-fixed conditions.",
  "conclusion": "output_ripple_is_0p2mv",
  "confidence": 0.95,
  "evidence_facts": [
    "psrr_is_100x_voltage_attenuation",
    "input_ripple_is_20mv"
  ],
  "held_fixed": [
    "frequency",
    "operating_point",
    "linearity"
  ],
  "mechanism": "Reference development explanation based only on supplied evidence.",
  "mechanism_tags": [
    "output_ripple_equals_input_divided_by_attenuation"
  ],
  "numeric_results": {},
  "recommended_actions": [
    "report_0p2mv_and_check_downstream_limit"
  ],
  "schema_version": "1.0",
  "task_id": "system_psrr_ripple--canonical"
}
