{
  "analysis_regime": "small_signal_and_transient",
  "claim_boundary": "Limited to the supplied operating regime and held-fixed conditions.",
  "conclusion": "single_knob_solution_fails_speed",
  "confidence": 0.95,
  "evidence_facts": [
    "phase_margin_passes",
    "bandwidth_and_settling_fail"
  ],
  "held_fixed": [
    "load",
    "pass_size",
    "driver"
  ],
  "mechanism": "Reference development explanation based only on supplied evidence.",
  "mechanism_tags": [
    "excess_dominant_compensation_trades_away_speed"
  ],
  "numeric_results": {},
  "recommended_actions": [
    "open_rzero_and_driver_coupled_search"
  ],
  "schema_version": "1.0",
  "task_id": "sizing_compensation_joint--counterexample"
}
