{
  "analysis_regime": "execution_status",
  "claim_boundary": "Limited to the supplied operating regime and held-fixed conditions.",
  "conclusion": "infra_license",
  "confidence": 0.95,
  "evidence_facts": [
    "simulator_stopped_before_elaboration",
    "no_operating_point_evidence_exists"
  ],
  "held_fixed": [
    "submitted_netlist",
    "simulator_binary",
    "license_feature"
  ],
  "mechanism": "Reference development explanation based only on supplied evidence.",
  "mechanism_tags": [
    "license_failure_is_not_circuit_failure",
    "missing_evidence_blocks_design_claim"
  ],
  "numeric_results": {},
  "recommended_actions": [
    "obtain_license_or_use_authorized_simulator",
    "rerun_same_candidate_before_tuning"
  ],
  "schema_version": "1.0",
  "task_id": "diagnosis_infra_vs_circuit--metamorphic"
}
