{
  "analysis_regime": "connectivity",
  "claim_boundary": "Limited to the supplied operating regime and held-fixed conditions.",
  "conclusion": "dut_policy_compliant",
  "confidence": 0.95,
  "evidence_facts": [
    "no_ideal_sources_inside_dut"
  ],
  "held_fixed": [
    "dut_hierarchy",
    "allowed_device_list"
  ],
  "mechanism": "Reference development explanation based only on supplied evidence.",
  "mechanism_tags": [
    "all_bias_and_startup_functions_are_physically_implemented"
  ],
  "numeric_results": {},
  "recommended_actions": [
    "retain_hierarchy_audit_in_qualification"
  ],
  "schema_version": "1.0",
  "task_id": "design_closure_forbidden_ideal--metamorphic"
}
