{
  "analysis_regime": "dc_operating_point",
  "claim_boundary": "Limited to the supplied operating regime and held-fixed conditions.",
  "conclusion": "measurement_sign_report_is_wrong",
  "confidence": 0.95,
  "evidence_facts": [
    "positive_source_current_means_source_absorbs_current"
  ],
  "held_fixed": [
    "probe_orientation",
    "load"
  ],
  "mechanism": "Reference development explanation based only on supplied evidence.",
  "mechanism_tags": [
    "reported_direction_contradicts_convention"
  ],
  "numeric_results": {},
  "recommended_actions": [
    "correct_report_or_probe_orientation"
  ],
  "schema_version": "1.0",
  "task_id": "diagnosis_measurement_sign--counterexample"
}
